{
  "episode_title": "Eurovision Top 20 Most Watched: September 2023 | #UnitedByMusic",
  "period": {
    "year": 2023,
    "month": 9
  },
  "youtube_video_id": "B6r7eeUtAFQ",
  "entries": [
    {
      "rank": 1,
      "video_title": "Little Big - Uno - Russia 🇷🇺 - Official Music Video - Eurovision 2020",
      "youtube_video_id": "L_dWvTCdDQ4"
    },
    {
      "rank": 2,
      "video_title": "Käärijä - Cha Cha Cha (LIVE) | Finland 🇫🇮 | Grand Final | Eurovision 2023",
      "youtube_video_id": "l6rS8Dv5g-8"
    },
    {
      "rank": 3,
      "video_title": "Alexander Rybak - Fairytale (LIVE) | Norway 🇳🇴 | Grand Final | Winner of Eurovision 2009",
      "youtube_video_id": "WXwgZL4zx9o"
    },
    {
      "rank": 4,
      "video_title": "Loreen - Tattoo (LIVE) | Sweden 🇸🇪 | Grand Final | Winner of Eurovision 2023",
      "youtube_video_id": "BE2Fj0W4jP4"
    },
    {
      "rank": 5,
      "video_title": "Hadise - Düm Tek Tek - Türkiye 🇹🇷 - Grand Final - Eurovision 2009",
      "youtube_video_id": "TzKgojZqO5Y"
    },
    {
      "rank": 6,
      "video_title": "Noa Kirel - Unicorn (LIVE) | Israel 🇮🇱 | Grand Final | Eurovision 2023",
      "youtube_video_id": "Z3mIcCllJXY"
    },
    {
      "rank": 7,
      "video_title": "Chanel - SloMo (LIVE) | Spain 🇪🇸 | Grand Final | Eurovision 2022",
      "youtube_video_id": "jSQYTt4xg3I"
    },
    {
      "rank": 8,
      "video_title": "Alessandra - Queen of Kings (LIVE) | Norway 🇳🇴 | Grand Final | Eurovision 2023",
      "youtube_video_id": "PUHSM_vTqTI"
    },
    {
      "rank": 9,
      "video_title": "Måneskin - Zitti E Buoni (LIVE) | Italy 🇮🇹 | Grand Final | Winner of Eurovision 2021",
      "youtube_video_id": "RVH5dn1cxAQ"
    },
    {
      "rank": 10,
      "video_title": "Loreen - Euphoria (LIVE) | Sweden 🇸🇪 | Grand Final | Winner of Eurovision 2012",
      "youtube_video_id": "Pfo-8z86x80"
    },
    {
      "rank": 11,
      "video_title": "Blanka - Solo (LIVE) | Poland 🇵🇱 | Grand Final | Eurovision 2023",
      "youtube_video_id": "SEgF1aP-U1o"
    },
    {
      "rank": 12,
      "video_title": "Netta - TOY - Israel - Official Music Video - Eurovision 2018",
      "youtube_video_id": "CziHrYYSyPc"
    },
    {
      "rank": 13,
      "video_title": "Barbara Pravi - Voilà (LIVE) | France 🇫🇷 | Grand Final | Eurovision 2021",
      "youtube_video_id": "Unj9WbeLzRU"
    },
    {
      "rank": 14,
      "video_title": "Verka Serduchka - Dancing Lasha Tumbai (LIVE) | Ukraine 🇺🇦 | Grand Final | Eurovision 2007",
      "youtube_video_id": "hfjHJneVonE"
    },
    {
      "rank": 15,
      "video_title": "Go_A - SHUM - Ukraine 🇺🇦 Official Music Video - Eurovision 2021",
      "youtube_video_id": "U7-dxzp6Jvs"
    },
    {
      "rank": 16,
      "video_title": "maNga - We Could Be The Same - Turkey 🇹🇷 - Grand Final - Eurovision 2010",
      "youtube_video_id": "HB_GnnhNz-8"
    },
    {
      "rank": 17,
      "video_title": "Duncan Laurence - Arcade (LIVE) | Netherlands 🇳🇱 | Grand Final | Winner of Eurovision 2019",
      "youtube_video_id": "R3D-r4ogr7s"
    },
    {
      "rank": 18,
      "video_title": "Sergey Lazarev - You Are The Only One 🇷🇺 Russia - Grand Final - Eurovision 2016",
      "youtube_video_id": "e94dst20C9Y"
    },
    {
      "rank": 19,
      "video_title": "Aysel and Arash - Always - 🇦🇿 Azerbaijan - Grand Final - Eurovision 2009",
      "youtube_video_id": "9OEIOS1oUeY"
    },
    {
      "rank": 20,
      "video_title": "Helena Paparizou - My Number One - Greece 🇬🇷 - Grand Final - Eurovision 2005",
      "youtube_video_id": "rcOwvZ26KFQ"
    }
  ]
}
