{
  "episode_title": "Eurovision Top 20 Most Watched: March 2024 | #UnitedByMusic",
  "period": {
    "year": 2024,
    "month": 3
  },
  "youtube_video_id": "WyZE-SdYCBE",
  "entries": [
    {
      "rank": 1,
      "video_title": "Joost Klein - Europapa | Netherlands 🇳🇱 | Official Music Video | Eurovision 2024",
      "youtube_video_id": "gT2wY0DjYGo"
    },
    {
      "rank": 2,
      "video_title": "Eden Golan - Hurricane | Israel 🇮🇱 | Official Music Video | Eurovision 2024",
      "youtube_video_id": "lJYn09tuPw4"
    },
    {
      "rank": 3,
      "video_title": "Marina Satti - ZARI | Greece 🇬🇷 | Official Music Video | Eurovision 2024",
      "youtube_video_id": "uTYalXf184A"
    },
    {
      "rank": 4,
      "video_title": "LADANIVA - Jako | Armenia 🇦🇲 | Official Music Video | Eurovision 2024",
      "youtube_video_id": "_6xfmW0Fc40"
    },
    {
      "rank": 5,
      "video_title": "Baby Lasagna - Rim Tim Tagi Dim | Croatia 🇭🇷 | National Final Performance | Eurovision 2024",
      "youtube_video_id": "EBsgTJQFl9k"
    },
    {
      "rank": 6,
      "video_title": "Angelina Mango - La Noia | Italy 🇮🇹 | National Final Performance | Eurovision 2024",
      "youtube_video_id": "OKzWskcTTA8"
    },
    {
      "rank": 7,
      "video_title": "alyona alyona & Jerry Heil - Teresa & Maria | Ukraine 🇺🇦 | Official Music Video | Eurovision 2024",
      "youtube_video_id": "k_8cNbF8FLI"
    },
    {
      "rank": 8,
      "video_title": "Alexander Rybak - Fairytale (LIVE) | Norway 🇳🇴 | Grand Final | Winner of Eurovision 2009",
      "youtube_video_id": "WXwgZL4zx9o"
    },
    {
      "rank": 9,
      "video_title": "Nemo - The Code | Switzerland 🇨🇭 | Official Music Video | Eurovision 2024",
      "youtube_video_id": "kiGDvM14Kwg"
    },
    {
      "rank": 10,
      "video_title": "Nutsa Buzaladze - Firefighter | Georgia 🇬🇪 | Official Music Video | Eurovision 2024",
      "youtube_video_id": "blMwY8Jabyk"
    },
    {
      "rank": 11,
      "video_title": "Mustii - Before the Party’s Over | Belgium 🇧🇪 | Official Music Video | Eurovision 2024",
      "youtube_video_id": "WCe9zrWEFNc"
    },
    {
      "rank": 12,
      "video_title": "Marcus & Martinus - Unforgettable | Sweden 🇸🇪 | Official Music Video | Eurovision 2024",
      "youtube_video_id": "yekc8t0rJqA"
    },
    {
      "rank": 13,
      "video_title": "Sunstroke Project & Olia Tira - Run Away | Moldova 🇲🇩 (Epic Sax Guy) | Grand Final | Eurovision 2010",
      "youtube_video_id": "pHXDMe6QV-U"
    },
    {
      "rank": 14,
      "video_title": "Silia Kapsis - Liar | Cyprus 🇨🇾 | Official Music Video | Eurovision 2024",
      "youtube_video_id": "8q5QozrtEPA"
    },
    {
      "rank": 15,
      "video_title": "Olly Alexander - Dizzy | United Kingdom 🇬🇧 | Official Music Video | Eurovision 2024",
      "youtube_video_id": "mvs92WfR8lM"
    },
    {
      "rank": 16,
      "video_title": "Käärijä - Cha Cha Cha (LIVE) | Finland 🇫🇮 | Grand Final | Eurovision 2023",
      "youtube_video_id": "l6rS8Dv5g-8"
    },
    {
      "rank": 17,
      "video_title": "Kaleen - We Will Rave | Austria 🇦🇹 | Official Music Video | Eurovision 2024",
      "youtube_video_id": "Kqda15G4T-4"
    },
    {
      "rank": 18,
      "video_title": "Baby Lasagna - Rim Tim Tagi Dim | Croatia 🇭🇷 | Official Music Video | Eurovision 2024",
      "youtube_video_id": "xTBrVNZtnys"
    },
    {
      "rank": 19,
      "video_title": "FAHREE feat. Ilkin Dovlatov - Özünlə Apar | Azerbaijan 🇦🇿 | Showcase Performance | Eurovision 2024",
      "youtube_video_id": "NNhAk4rVgNc"
    },
    {
      "rank": 20,
      "video_title": "Silvester Belt - Luktelk | Lithuania 🇱🇹 | National Final Performance | Eurovision 2024",
      "youtube_video_id": "OrL668EQRu0"
    }
  ]
}
