{
  "episode_title": "Eurovision Top 20 Most Watched: January 2023",
  "period": {
    "year": 2023,
    "month": 1
  },
  "youtube_video_id": "4OleEd6rG-Q",
  "entries": [
    {
      "rank": 1,
      "video_title": "Little Big - Uno - Russia 🇷🇺 - Official Music Video - Eurovision 2020",
      "youtube_video_id": "L_dWvTCdDQ4"
    },
    {
      "rank": 2,
      "video_title": "Luiz Ejlli - Zjarr E Ftohtë | Albania 🇦🇱 | Semi-Final | Eurovision 2006",
      "youtube_video_id": "z_r4IzbwDY4"
    },
    {
      "rank": 3,
      "video_title": "Hadise - Düm Tek Tek - Türkiye 🇹🇷 - Grand Final - Eurovision 2009",
      "youtube_video_id": "TzKgojZqO5Y"
    },
    {
      "rank": 4,
      "video_title": "Alexander Rybak - Fairytale (LIVE) | Norway 🇳🇴 | Grand Final | Winner of Eurovision 2009",
      "youtube_video_id": "WXwgZL4zx9o"
    },
    {
      "rank": 5,
      "video_title": "Chanel - SloMo (LIVE) | Spain 🇪🇸 | Grand Final | Eurovision 2022",
      "youtube_video_id": "jSQYTt4xg3I"
    },
    {
      "rank": 6,
      "video_title": "Netta - TOY - Israel - Official Music Video - Eurovision 2018",
      "youtube_video_id": "CziHrYYSyPc"
    },
    {
      "rank": 7,
      "video_title": "Måneskin - Zitti E Buoni (LIVE) | Italy 🇮🇹 | Grand Final | Winner of Eurovision 2021",
      "youtube_video_id": "RVH5dn1cxAQ"
    },
    {
      "rank": 8,
      "video_title": "Gustaph - Because Of You | Belgium 🇧🇪 | National Final Performance | Eurovision 2023",
      "youtube_video_id": "uYWhh-E_VPo"
    },
    {
      "rank": 9,
      "video_title": "Kalush Orchestra - Stefania (LIVE) | Ukraine 🇺🇦 | Grand Final | Winner of Eurovision 2022",
      "youtube_video_id": "F1fl60ypdLs"
    },
    {
      "rank": 10,
      "video_title": "Albina & Familja Kelmendi - Duje | Albania 🇦🇱 | National Final Performance | Eurovision 2023",
      "youtube_video_id": "aZxe3Ce6yEI"
    },
    {
      "rank": 11,
      "video_title": "Go_A - SHUM - Ukraine 🇺🇦 Official Music Video - Eurovision 2021",
      "youtube_video_id": "U7-dxzp6Jvs"
    },
    {
      "rank": 12,
      "video_title": "Verka Serduchka - Dancing Lasha Tumbai (LIVE) | Ukraine 🇺🇦 | Grand Final | Eurovision 2007",
      "youtube_video_id": "hfjHJneVonE"
    },
    {
      "rank": 13,
      "video_title": "Rosa Linn - Snap - Armenia 🇦🇲 - Official Music Video - Eurovision 2022",
      "youtube_video_id": "gVqGKkm7xBE"
    },
    {
      "rank": 14,
      "video_title": "maNga - We Could Be The Same - Turkey 🇹🇷 - Grand Final - Eurovision 2010",
      "youtube_video_id": "HB_GnnhNz-8"
    },
    {
      "rank": 15,
      "video_title": "Aysel and Arash - Always - 🇦🇿 Azerbaijan - Grand Final - Eurovision 2009",
      "youtube_video_id": "9OEIOS1oUeY"
    },
    {
      "rank": 16,
      "video_title": "Loreen - Euphoria (LIVE) | Sweden 🇸🇪 | Grand Final | Winner of Eurovision 2012",
      "youtube_video_id": "Pfo-8z86x80"
    },
    {
      "rank": 17,
      "video_title": "WRS - Llámame - LIVE - Romania 🇷🇴 - Grand Final - Eurovision 2022",
      "youtube_video_id": "nPpuwy79sHs"
    },
    {
      "rank": 18,
      "video_title": "Duncan Laurence - Arcade (LIVE) | Netherlands 🇳🇱 | Grand Final | Winner of Eurovision 2019",
      "youtube_video_id": "R3D-r4ogr7s"
    },
    {
      "rank": 19,
      "video_title": "Lordi - Hard Rock Hallelujah (LIVE) | Finland 🇫🇮 | Grand Final | Winner of Eurovision 2006",
      "youtube_video_id": "gAh9NRGNhUU"
    },
    {
      "rank": 20,
      "video_title": "TVORCHI - Heart Of Steel | Ukraine 🇺🇦 | National Final Performance | Eurovision 2023",
      "youtube_video_id": "q6QFVqWX2gM"
    }
  ]
}
