{
  "episode_title": "Eurovision Top 20: Most Watched – May 2026 | #Eurovision2026",
  "period": {
    "year": 2026,
    "month": 5
  },
  "youtube_video_id": "gViJV8oS74Q",
  "entries": [
    {
      "rank": 1,
      "video_title": "DARA - Bangaranga (LIVE) | Bulgaria 🇧🇬 | Grand Final | Winner of Eurovision 2026",
      "youtube_video_id": "EltgrumKJfk"
    },
    {
      "rank": 2,
      "video_title": "Akylas - Ferto (LIVE) | Greece 🇬🇷 | Grand Final | Eurovision 2026",
      "youtube_video_id": "Rfd-6uAG4Rc"
    },
    {
      "rank": 3,
      "video_title": "Noam Bettan - Michelle (LIVE) | Israel 🇮🇱 | Grand Final | Eurovision 2026",
      "youtube_video_id": "E2aL4xRzNXI"
    },
    {
      "rank": 4,
      "video_title": "Alexandra Căpitănescu - Choke Me (LIVE) | Romania 🇷🇴 | Grand Final | Eurovision 2026",
      "youtube_video_id": "TpMQ6dhcvvE"
    },
    {
      "rank": 5,
      "video_title": "AIDAN - Bella (LIVE) | Malta 🇲🇹 | Grand Final | Eurovision 2026",
      "youtube_video_id": "03FaNB7J0A4"
    },
    {
      "rank": 6,
      "video_title": "Alexander Rybak - Fairytale (LIVE) | Norway 🇳🇴 | Grand Final | Winner of Eurovision 2009",
      "youtube_video_id": "WXwgZL4zx9o"
    },
    {
      "rank": 7,
      "video_title": "DARA - Bangaranga | Bulgaria 🇧🇬 | Official Music Video | #Eurovision2026",
      "youtube_video_id": "J3oGYo_mekw"
    },
    {
      "rank": 8,
      "video_title": "Sal Da Vinci - Per Sempre Sì (LIVE) | Italy 🇮🇹 | Grand Final | Eurovision 2026",
      "youtube_video_id": "rNpFNJLhSfA"
    },
    {
      "rank": 9,
      "video_title": "Satoshi - Viva, Moldova! (LIVE) | Moldova 🇲🇩 | Grand Final | Eurovision 2026",
      "youtube_video_id": "CKV15yxAsIQ"
    },
    {
      "rank": 10,
      "video_title": "Antigoni - JALLA (LIVE) | Cyprus 🇨🇾 | Grand Final | Eurovision 2026",
      "youtube_video_id": "7i-k5QR6A6I"
    },
    {
      "rank": 11,
      "video_title": "Linda Lampenius x Pete Parkkonen - Liekinheitin (LIVE) | Finland 🇫🇮 | Grand Final | Eurovision 2026",
      "youtube_video_id": "CmPkrjTtrwE"
    },
    {
      "rank": 12,
      "video_title": "DARA - Bangaranga | Bulgaria 🇧🇬 | National Final Performance #Eurovision2026",
      "youtube_video_id": "_pkC9J6BPFY"
    },
    {
      "rank": 13,
      "video_title": "Delta Goodrem - Eclipse (LIVE) | Australia 🇦🇺 | Grand Final | Eurovision 2026",
      "youtube_video_id": "QMm2aqdsrOU"
    },
    {
      "rank": 14,
      "video_title": "LELEK - Andromeda (LIVE) | Croatia 🇭🇷 | Grand Final | Eurovision 2026",
      "youtube_video_id": "7J05a7u3NGs"
    },
    {
      "rank": 15,
      "video_title": "ALICJA - Pray (LIVE) | Poland 🇵🇱 | Grand Final | Eurovision 2026",
      "youtube_video_id": "NRTkNIyT_S0"
    },
    {
      "rank": 16,
      "video_title": "Sarah Engels - Fire (LIVE) | Germany 🇩🇪 | Grand Final | Eurovision 2026",
      "youtube_video_id": "KnKVUztvN3M"
    },
    {
      "rank": 17,
      "video_title": "AIDAN - Bella | Malta 🇲🇹 | Official Music Video | #Eurovision2026",
      "youtube_video_id": "CW6mQLBh6Js"
    },
    {
      "rank": 18,
      "video_title": "FELICIA - My System (LIVE) | Sweden 🇸🇪 | Grand Final | Eurovision 2026",
      "youtube_video_id": "6pmj0jbFKGU"
    },
    {
      "rank": 19,
      "video_title": "Tommy Cash - Espresso Macchiato (LIVE) | Estonia 🇪🇪 | Grand Final | Eurovision 2025",
      "youtube_video_id": "9b9Z5HSCXOI"
    },
    {
      "rank": 20,
      "video_title": "LELÉKA - Ridnym (LIVE) | Ukraine 🇺🇦 | Grand Final | Eurovision 2026",
      "youtube_video_id": "JYHhcKhzE-o"
    }
  ]
}
