{
  "episode_title": "TOP 10: Most watched in June 2019 - Eurovision Song Contest",
  "period": {
    "year": 2019,
    "month": 6
  },
  "youtube_video_id": "H1sV-NOMvIw",
  "entries": [
    {
      "rank": 1,
      "video_title": "Duncan Laurence - Arcade (LIVE) | Netherlands 🇳🇱 | Grand Final | Winner of Eurovision 2019",
      "youtube_video_id": "R3D-r4ogr7s"
    },
    {
      "rank": 2,
      "video_title": "Mahmood - Soldi (LIVE) | Italy 🇮🇹 | Grand Final | Eurovision 2019",
      "youtube_video_id": "M-aoyPa41Ic"
    },
    {
      "rank": 3,
      "video_title": "Luca Hänni - She Got Me (LIVE) | Switzerland 🇨🇭 | Grand Final | Eurovision 2019",
      "youtube_video_id": "8aUYzqAIdoM"
    },
    {
      "rank": 4,
      "video_title": "KEiiNO - Spirit In The Sky (LIVE) | Norway 🇳🇴 | Grand Final | Eurovision 2019",
      "youtube_video_id": "Ovt7YGHAj8I"
    },
    {
      "rank": 5,
      "video_title": "Netta - Toy (LIVE) | Israel 🇮🇱 | Grand Final | Winner of Eurovision 2018",
      "youtube_video_id": "84LBjXaeKk4"
    },
    {
      "rank": 6,
      "video_title": "Michela - Chameleon (LIVE) | Malta 🇲🇹 | Grand Final | Eurovision 2019",
      "youtube_video_id": "H-byNyainRA"
    },
    {
      "rank": 7,
      "video_title": "Tamta - Replay (LIVE) | Cyprus 🇨🇾 | Grand Final | Eurovision 2019",
      "youtube_video_id": "wIpEI-NhRxg"
    },
    {
      "rank": 8,
      "video_title": "Eleni Foureira - Fuego (LIVE) | Cyprus 🇨🇾 | Grand Final | Eurovision 2018",
      "youtube_video_id": "vyDTbJ4wenY"
    },
    {
      "rank": 9,
      "video_title": "Miki - La Venda (LIVE) | Spain 🇪🇸 | Grand Final | Eurovision 2019",
      "youtube_video_id": "lWXuohnM14U"
    },
    {
      "rank": 10,
      "video_title": "Bilal Hassani - Roi (LIVE) | France 🇫🇷 | Grand Final | Eurovision 2019",
      "youtube_video_id": "AjZNbIQtWvw"
    },
    {
      "rank": 11,
      "video_title": "",
      "youtube_video_id": ""
    },
    {
      "rank": 12,
      "video_title": "",
      "youtube_video_id": ""
    },
    {
      "rank": 13,
      "video_title": "",
      "youtube_video_id": ""
    },
    {
      "rank": 14,
      "video_title": "",
      "youtube_video_id": ""
    },
    {
      "rank": 15,
      "video_title": "",
      "youtube_video_id": ""
    },
    {
      "rank": 16,
      "video_title": "",
      "youtube_video_id": ""
    },
    {
      "rank": 17,
      "video_title": "",
      "youtube_video_id": ""
    },
    {
      "rank": 18,
      "video_title": "",
      "youtube_video_id": ""
    },
    {
      "rank": 19,
      "video_title": "",
      "youtube_video_id": ""
    },
    {
      "rank": 20,
      "video_title": "",
      "youtube_video_id": ""
    }
  ]
}
