{
  "episode_title": "TOP 10: Most watched in October 2018 - Eurovision Song Contest",
  "period": {
    "year": 2018,
    "month": 10
  },
  "youtube_video_id": "LOqywqM-_A8",
  "entries": [
    {
      "rank": 1,
      "video_title": "Netta - Toy (LIVE) | Israel 🇮🇱 | Grand Final | Winner of Eurovision 2018",
      "youtube_video_id": "84LBjXaeKk4"
    },
    {
      "rank": 2,
      "video_title": "Eleni Foureira - Fuego (LIVE) | Cyprus 🇨🇾 | Grand Final | Eurovision 2018",
      "youtube_video_id": "vyDTbJ4wenY"
    },
    {
      "rank": 3,
      "video_title": "Hadise - Düm Tek Tek - Türkiye 🇹🇷 - Grand Final - Eurovision 2009",
      "youtube_video_id": "TzKgojZqO5Y"
    },
    {
      "rank": 4,
      "video_title": "Mikolas Josef - Lie To Me (LIVE) | Czechia 🇨🇿 | Grand Final | Eurovision 2018",
      "youtube_video_id": "w0ZUuQe0shk"
    },
    {
      "rank": 5,
      "video_title": "maNga - We Could Be The Same - Turkey 🇹🇷 - Grand Final - Eurovision 2010",
      "youtube_video_id": "HB_GnnhNz-8"
    },
    {
      "rank": 6,
      "video_title": "Sergey Lazarev - You Are The Only One 🇷🇺 Russia - Grand Final - Eurovision 2016",
      "youtube_video_id": "e94dst20C9Y"
    },
    {
      "rank": 7,
      "video_title": "Lena - Satellite (LIVE) | Germany 🇩🇪 | Grand Final | Winner of Eurovision 2010",
      "youtube_video_id": "7pL9vdpSvnY"
    },
    {
      "rank": 8,
      "video_title": "Lordi - Hard Rock Hallelujah (LIVE) | Finland 🇫🇮 | Grand Final | Winner of Eurovision 2006",
      "youtube_video_id": "gAh9NRGNhUU"
    },
    {
      "rank": 9,
      "video_title": "Loreen - Euphoria (LIVE) | Sweden 🇸🇪 | Grand Final | Winner of Eurovision 2012",
      "youtube_video_id": "Pfo-8z86x80"
    },
    {
      "rank": 10,
      "video_title": "Aysel and Arash - Always - 🇦🇿 Azerbaijan - Grand Final - Eurovision 2009",
      "youtube_video_id": "9OEIOS1oUeY"
    },
    {
      "rank": 11,
      "video_title": "",
      "youtube_video_id": ""
    },
    {
      "rank": 12,
      "video_title": "",
      "youtube_video_id": ""
    },
    {
      "rank": 13,
      "video_title": "",
      "youtube_video_id": ""
    },
    {
      "rank": 14,
      "video_title": "",
      "youtube_video_id": ""
    },
    {
      "rank": 15,
      "video_title": "",
      "youtube_video_id": ""
    },
    {
      "rank": 16,
      "video_title": "",
      "youtube_video_id": ""
    },
    {
      "rank": 17,
      "video_title": "",
      "youtube_video_id": ""
    },
    {
      "rank": 18,
      "video_title": "",
      "youtube_video_id": ""
    },
    {
      "rank": 19,
      "video_title": "",
      "youtube_video_id": ""
    },
    {
      "rank": 20,
      "video_title": "",
      "youtube_video_id": ""
    }
  ]
}
