{
  "episode_title": "Eurovision Top 20 Most Watched: August 2026",
  "period": {
    "year": 2026,
    "month": 8
  },
  "youtube_video_id": "Lgazf5M6QIQ",
  "entries": [
    {
      "rank": 1,
      "video_title": "DARA - Bangaranga (LIVE) | Bulgaria 🇧🇬 | Grand Final | Winner of Eurovision 2026",
      "youtube_video_id": "EltgrumKJfk"
    },
    {
      "rank": 2,
      "video_title": "Alexander Rybak - Fairytale (LIVE) | Norway 🇳🇴 | Grand Final | Winner of Eurovision 2009",
      "youtube_video_id": "WXwgZL4zx9o"
    },
    {
      "rank": 3,
      "video_title": "Tommy Cash - Espresso Macchiato | Estonia 🇪🇪 | Official Music Video | #Eurovision2025",
      "youtube_video_id": "5MS_Fczs_98"
    },
    {
      "rank": 4,
      "video_title": "Tommy Cash - Espresso Macchiato (LIVE) | Estonia 🇪🇪 | Grand Final | Eurovision 2025",
      "youtube_video_id": "9b9Z5HSCXOI"
    },
    {
      "rank": 5,
      "video_title": "Noam Bettan - Michelle (LIVE) | Israel 🇮🇱 | Grand Final | Eurovision 2026",
      "youtube_video_id": "E2aL4xRzNXI"
    },
    {
      "rank": 6,
      "video_title": "Akylas - Ferto (LIVE) | Greece 🇬🇷 | Grand Final | Eurovision 2026",
      "youtube_video_id": "Rfd-6uAG4Rc"
    },
    {
      "rank": 7,
      "video_title": "Little Big - Uno - Russia 🇷🇺 - Official Music Video - Eurovision 2020",
      "youtube_video_id": "L_dWvTCdDQ4"
    },
    {
      "rank": 8,
      "video_title": "Antigoni - JALLA (LIVE) | Cyprus 🇨🇾 | Grand Final | Eurovision 2026",
      "youtube_video_id": "7i-k5QR6A6I"
    },
    {
      "rank": 9,
      "video_title": "Alexandra Căpitănescu - Choke Me (LIVE) | Romania 🇷🇴 | Grand Final | Eurovision 2026",
      "youtube_video_id": "TpMQ6dhcvvE"
    },
    {
      "rank": 10,
      "video_title": "DARA - Bangaranga | Bulgaria 🇧🇬 | Official Music Video | #Eurovision2026",
      "youtube_video_id": "J3oGYo_mekw"
    },
    {
      "rank": 11,
      "video_title": "Sunstroke Project & Olia Tira - Run Away | Moldova 🇲🇩 (Epic Sax Guy) | Grand Final | Eurovision 2010",
      "youtube_video_id": "pHXDMe6QV-U"
    },
    {
      "rank": 12,
      "video_title": "Sal Da Vinci - Per Sempre Sì (LIVE) | Italy 🇮🇹 | Grand Final | Eurovision 2026",
      "youtube_video_id": "rNpFNJLhSfA"
    },
    {
      "rank": 13,
      "video_title": "Azúcar Moreno - Bandido | Spain 🇪🇸 | Grand Final | Eurovision 1990",
      "youtube_video_id": "7dGysPC_q9k"
    },
    {
      "rank": 14,
      "video_title": "Baby Lasagna - Rim Tim Tagi Dim (LIVE) | Croatia 🇭🇷 | Grand Final | Eurovision 2024",
      "youtube_video_id": "YIBjarAiAVc"
    },
    {
      "rank": 15,
      "video_title": "Antigoni - JALLA | Cyprus 🇨🇾 | Official Music Video | #Eurovision2026",
      "youtube_video_id": "TzSs51BiQrE"
    },
    {
      "rank": 16,
      "video_title": "Joost Klein - Europapa (LIVE) | Netherlands 🇳🇱 | Second Semi-Final | Eurovision 2024",
      "youtube_video_id": "IiHFnmI8pxg"
    },
    {
      "rank": 17,
      "video_title": "Satoshi - Viva, Moldova! (LIVE) | Moldova 🇲🇩 | Grand Final | Eurovision 2026",
      "youtube_video_id": "CKV15yxAsIQ"
    },
    {
      "rank": 18,
      "video_title": "LELEK - Andromeda (LIVE) | Croatia 🇭🇷 | Grand Final | Eurovision 2026",
      "youtube_video_id": "7J05a7u3NGs"
    },
    {
      "rank": 19,
      "video_title": "Käärijä & Baby Lasagna - #eurodab - Winners Of Our Hearts at Eurovision 2025 | #UnitedByMusic ​​🇨🇭",
      "youtube_video_id": "DGsL8hA-1rE"
    },
    {
      "rank": 20,
      "video_title": "Slimane - Mon Amour (LIVE) | France 🇫🇷 | Grand Final | Eurovision 2024",
      "youtube_video_id": "-XyLecY2JyE"
    }
  ]
}
