{
  "episode_title": "TOP 10: Most watched in April 2017 - Eurovision Song Contest",
  "period": {
    "year": 2017,
    "month": 4
  },
  "youtube_video_id": "IGMzRdDJbfA",
  "entries": [
    {
      "rank": 1,
      "video_title": "Jessy Matador - Allez Ola Olé (France) - Eurovision Song Contest 2010 - Music Video",
      "youtube_video_id": "IX2pxtkhx-M"
    },
    {
      "rank": 2,
      "video_title": "Robin Bengtsson - I Can't Go On (Sweden) Eurovision 2017 - Official Music Video",
      "youtube_video_id": "1jSrBdN4b5c"
    },
    {
      "rank": 3,
      "video_title": "Francesco Gabbani - Occidentali's Karma (Italy) Eurovision 2017 - National Final Performance",
      "youtube_video_id": "xmpc3fcrNJQ"
    },
    {
      "rank": 4,
      "video_title": "Blanche - City Lights (Belgium) Eurovision 2017 - Official Music Video",
      "youtube_video_id": "xbomdE81_mA"
    },
    {
      "rank": 5,
      "video_title": "Alma - Requiem (France) Eurovision 2017 - Official Music Video",
      "youtube_video_id": "Koi36aeRv7I"
    },
    {
      "rank": 6,
      "video_title": "Valentina Monetta & Jimmie Wilson - Spirit Of The Night (San Marino) - Official Music Video",
      "youtube_video_id": "CXiQr2ew3lQ"
    },
    {
      "rank": 7,
      "video_title": "Julia Samoylova - Flame Is Burning (Russia) Eurovision 2017 - Official Video",
      "youtube_video_id": "Qu5kSWkZqOI"
    },
    {
      "rank": 8,
      "video_title": "Kristian Kostov - Beautiful Mess (Bulgaria) Eurovision 2017 - Official Lyric Video",
      "youtube_video_id": "nM7s8lBNdLg"
    },
    {
      "rank": 9,
      "video_title": "Sergey Lazarev - You Are The Only One 🇷🇺 Russia - Grand Final - Eurovision 2016",
      "youtube_video_id": "e94dst20C9Y"
    },
    {
      "rank": 10,
      "video_title": "Isaiah - Don't Come Easy (Australia) Eurovision 2017 - Official Music Video",
      "youtube_video_id": "RiXEMYUqa3w"
    },
    {
      "rank": 11,
      "video_title": "",
      "youtube_video_id": ""
    },
    {
      "rank": 12,
      "video_title": "",
      "youtube_video_id": ""
    },
    {
      "rank": 13,
      "video_title": "",
      "youtube_video_id": ""
    },
    {
      "rank": 14,
      "video_title": "",
      "youtube_video_id": ""
    },
    {
      "rank": 15,
      "video_title": "",
      "youtube_video_id": ""
    },
    {
      "rank": 16,
      "video_title": "",
      "youtube_video_id": ""
    },
    {
      "rank": 17,
      "video_title": "",
      "youtube_video_id": ""
    },
    {
      "rank": 18,
      "video_title": "",
      "youtube_video_id": ""
    },
    {
      "rank": 19,
      "video_title": "",
      "youtube_video_id": ""
    },
    {
      "rank": 20,
      "video_title": "",
      "youtube_video_id": ""
    }
  ]
}
