{
  "episode_title": "Top 20 Most Watched: September 2025 | #Eurovision2025",
  "period": {
    "year": 2025,
    "month": 9
  },
  "youtube_video_id": "c0jy6Zr6Fxg",
  "entries": [
    {
      "rank": 1,
      "video_title": "Tommy Cash - Espresso Macchiato | Estonia 🇪🇪 | Official Music Video | #Eurovision2025",
      "youtube_video_id": "5MS_Fczs_98"
    },
    {
      "rank": 2,
      "video_title": "Tommy Cash - Espresso Macchiato (LIVE) | Estonia 🇪🇪 | Grand Final | Eurovision 2025",
      "youtube_video_id": "9b9Z5HSCXOI"
    },
    {
      "rank": 3,
      "video_title": "Alexander Rybak - Fairytale (LIVE) | Norway 🇳🇴 | Grand Final | Winner of Eurovision 2009",
      "youtube_video_id": "WXwgZL4zx9o"
    },
    {
      "rank": 4,
      "video_title": "Käärijä & Baby Lasagna - #eurodab - Winners Of Our Hearts at Eurovision 2025 | #UnitedByMusic ​​🇨🇭",
      "youtube_video_id": "DGsL8hA-1rE"
    },
    {
      "rank": 5,
      "video_title": "KAJ - Bara Bada Bastu (LIVE) | Sweden 🇸🇪 | Grand Final | Eurovision 2025",
      "youtube_video_id": "WSh7U3m9KgA"
    },
    {
      "rank": 6,
      "video_title": "Little Big - Uno - Russia 🇷🇺 - Official Music Video - Eurovision 2020",
      "youtube_video_id": "L_dWvTCdDQ4"
    },
    {
      "rank": 7,
      "video_title": "Baby Lasagna - Rim Tim Tagi Dim (LIVE) | Croatia 🇭🇷 | Grand Final | Eurovision 2024",
      "youtube_video_id": "YIBjarAiAVc"
    },
    {
      "rank": 8,
      "video_title": "Melody - ESA DIVA (LIVE) | Spain 🇪🇸 | Grand Final | Eurovision 2025",
      "youtube_video_id": "IEKSa9FVLqA"
    },
    {
      "rank": 9,
      "video_title": "Joost Klein - Europapa (LIVE) | Netherlands 🇳🇱 | Second Semi-Final | Eurovision 2024",
      "youtube_video_id": "IiHFnmI8pxg"
    },
    {
      "rank": 10,
      "video_title": "Abor & Tynna – Baller (LIVE) | Germany 🇩🇪 | Grand Final | Eurovision 2025",
      "youtube_video_id": "3rrWZ6cldsA"
    },
    {
      "rank": 11,
      "video_title": "JJ – Wasted Love (LIVE) | Austria 🇦🇹 | Grand Final | Winner of Eurovision 2025",
      "youtube_video_id": "onOex2WXjbA"
    },
    {
      "rank": 12,
      "video_title": "Sunstroke Project & Olia Tira - Run Away | Moldova 🇲🇩 (Epic Sax Guy) | Grand Final | Eurovision 2010",
      "youtube_video_id": "pHXDMe6QV-U"
    },
    {
      "rank": 13,
      "video_title": "VÆB - RÓA (LIVE) | Iceland 🇮🇸 | Grand Final | Eurovision 2025",
      "youtube_video_id": "c73Lx1QUZZA"
    },
    {
      "rank": 14,
      "video_title": "KAJ - Bara Bada Bastu | Sweden 🇸🇪 | Official Music Video | #Eurovision2025",
      "youtube_video_id": "WK3HOMhAeQY"
    },
    {
      "rank": 15,
      "video_title": "Kyle Alessandro - Lighter (LIVE) | Norway 🇳🇴 | Grand Final | Eurovision 2025",
      "youtube_video_id": "gQOGxx6Fk9k"
    },
    {
      "rank": 16,
      "video_title": "Slimane - Mon Amour (LIVE) | France 🇫🇷 | Grand Final | Eurovision 2024",
      "youtube_video_id": "-XyLecY2JyE"
    },
    {
      "rank": 17,
      "video_title": "Joost Klein - Europapa | Netherlands 🇳🇱 | Official Music Video | Eurovision 2024",
      "youtube_video_id": "gT2wY0DjYGo"
    },
    {
      "rank": 18,
      "video_title": "alyona alyona & Jerry Heil - Teresa & Maria (LIVE) | Ukraine 🇺🇦 | Grand Final | Eurovision 2024",
      "youtube_video_id": "d4N82wPpdg8"
    },
    {
      "rank": 19,
      "video_title": "Klavdia – Asteromáta (LIVE) | Greece 🇬🇷 | Grand Final | Eurovision 2025",
      "youtube_video_id": "1qbWRl6h6to"
    },
    {
      "rank": 20,
      "video_title": "Käärijä - Cha Cha Cha (LIVE) | Finland 🇫🇮 | Grand Final | Eurovision 2023",
      "youtube_video_id": "l6rS8Dv5g-8"
    }
  ]
}
