{
  "episode_title": "Eurovision Top 20: Most Watched – April 2026 | #Eurovision2026",
  "period": {
    "year": 2026,
    "month": 4
  },
  "youtube_video_id": "4EFQohx0ChY",
  "entries": [
    {
      "rank": 1,
      "video_title": "Alexander Rybak - Fairytale (LIVE) | Norway 🇳🇴 | Grand Final | Winner of Eurovision 2009",
      "youtube_video_id": "WXwgZL4zx9o"
    },
    {
      "rank": 2,
      "video_title": "Tommy Cash - Espresso Macchiato (LIVE) | Estonia 🇪🇪 | Grand Final | Eurovision 2025",
      "youtube_video_id": "9b9Z5HSCXOI"
    },
    {
      "rank": 3,
      "video_title": "Tommy Cash - Espresso Macchiato | Estonia 🇪🇪 | Official Music Video | #Eurovision2025",
      "youtube_video_id": "5MS_Fczs_98"
    },
    {
      "rank": 4,
      "video_title": "Antigoni - JALLA | Cyprus 🇨🇾 | Official Music Video | #Eurovision2026",
      "youtube_video_id": "TzSs51BiQrE"
    },
    {
      "rank": 5,
      "video_title": "Sal Da Vinci - Per Sempre Sì | Italy 🇮🇹 | Sanremo (National Final Performance) #Eurovision2026",
      "youtube_video_id": "kA7pS6kaTpg"
    },
    {
      "rank": 6,
      "video_title": "Linda Lampenius x Pete Parkkonen - Liekinheitin | Finland 🇫🇮 | Official Music Video | #Eurovision",
      "youtube_video_id": "9bfwNIYb96Q"
    },
    {
      "rank": 7,
      "video_title": "AIDAN - Bella | Malta 🇲🇹 | National Final Performance | #Eurovision2026",
      "youtube_video_id": "zpnUWz6NKMw"
    },
    {
      "rank": 8,
      "video_title": "Noam Bettan - Michelle | Israel 🇮🇱 | Official Music Video | #Eurovision2026",
      "youtube_video_id": "xWCnWSoG8nI"
    },
    {
      "rank": 9,
      "video_title": "Akylas - Ferto | Greece 🇬🇷 | Official Music Video | #Eurovision2026",
      "youtube_video_id": "NGwNTd_DA9s"
    },
    {
      "rank": 10,
      "video_title": "Sunstroke Project & Olia Tira - Run Away | Moldova 🇲🇩 (Epic Sax Guy) | Grand Final | Eurovision 2010",
      "youtube_video_id": "pHXDMe6QV-U"
    },
    {
      "rank": 11,
      "video_title": "AIDAN - Bella | Malta 🇲🇹 | Official Music Video | #Eurovision2026",
      "youtube_video_id": "CW6mQLBh6Js"
    },
    {
      "rank": 12,
      "video_title": "Sal Da Vinci - Per Sempre Sì | Italy 🇮🇹 | Official Music Video | #Eurovision2026",
      "youtube_video_id": "V406FAGkhyQ"
    },
    {
      "rank": 13,
      "video_title": "Søren Torpegaard Lund - Før Vi Går Hjem | Denmark 🇩🇰 | National Final Performance | #Eurovision2026",
      "youtube_video_id": "xKzEP9dwoss"
    },
    {
      "rank": 14,
      "video_title": "Joost Klein - Europapa (LIVE) | Netherlands 🇳🇱 | Second Semi-Final | Eurovision 2024",
      "youtube_video_id": "IiHFnmI8pxg"
    },
    {
      "rank": 15,
      "video_title": "Baby Lasagna - Rim Tim Tagi Dim (LIVE) | Croatia 🇭🇷 | Grand Final | Eurovision 2024",
      "youtube_video_id": "YIBjarAiAVc"
    },
    {
      "rank": 16,
      "video_title": "Monroe - Regarde ! | France 🇫🇷 | Official Music Video #Eurovision2026",
      "youtube_video_id": "ujoCYrvvTYQ"
    },
    {
      "rank": 17,
      "video_title": "Little Big - Uno - Russia 🇷🇺 - Official Music Video - Eurovision 2020",
      "youtube_video_id": "L_dWvTCdDQ4"
    },
    {
      "rank": 18,
      "video_title": "Käärijä & Baby Lasagna - #eurodab - Winners Of Our Hearts at Eurovision 2025 | #UnitedByMusic ​​🇨🇭",
      "youtube_video_id": "DGsL8hA-1rE"
    },
    {
      "rank": 19,
      "video_title": "DARA - Bangaranga | Bulgaria 🇧🇬 | Official Music Video | #Eurovision2026",
      "youtube_video_id": "J3oGYo_mekw"
    },
    {
      "rank": 20,
      "video_title": "Alexandra Căpitănescu - Choke Me | Romania 🇷🇴 | Official Music Video | #Eurovision2026",
      "youtube_video_id": "yn0YmI0dPb8"
    }
  ]
}
