{
  "episode_title": "TOP 10: Most watched in February 2021 - Eurovision Song Contest",
  "period": {
    "year": 2021,
    "month": 2
  },
  "youtube_video_id": "7xztfDrMQ4E",
  "entries": [
    {
      "rank": 1,
      "video_title": "Little Big - Uno - Russia 🇷🇺 - Official Music Video - Eurovision 2020",
      "youtube_video_id": "L_dWvTCdDQ4"
    },
    {
      "rank": 2,
      "video_title": "Albina - Tick-Tock - Croatia 🇭🇷 - National Final Performance - Eurovision 2021",
      "youtube_video_id": "lT277q29VpE"
    },
    {
      "rank": 3,
      "video_title": "Netta - Toy (LIVE) | Israel 🇮🇱 | Grand Final | Winner of Eurovision 2018",
      "youtube_video_id": "84LBjXaeKk4"
    },
    {
      "rank": 4,
      "video_title": "Duncan Laurence - Arcade (LIVE) | Netherlands 🇳🇱 | Grand Final | Winner of Eurovision 2019",
      "youtube_video_id": "R3D-r4ogr7s"
    },
    {
      "rank": 5,
      "video_title": "Alexander Rybak - Fairytale (LIVE) | Norway 🇳🇴 | Grand Final | Winner of Eurovision 2009",
      "youtube_video_id": "WXwgZL4zx9o"
    },
    {
      "rank": 6,
      "video_title": "Hadise - Düm Tek Tek - Türkiye 🇹🇷 - Grand Final - Eurovision 2009",
      "youtube_video_id": "TzKgojZqO5Y"
    },
    {
      "rank": 7,
      "video_title": "The Roop - Discoteque - Lithuania 🇱🇹 - Official Video - Eurovision 2021",
      "youtube_video_id": "0rsUJWSwb0c"
    },
    {
      "rank": 8,
      "video_title": "Barbara Pravi - Voilà - France 🇫🇷 - Official Music Video - Eurovision 2021",
      "youtube_video_id": "-9t_SwPN31s"
    },
    {
      "rank": 9,
      "video_title": "TIX - Fallen Angel - Norway 🇳🇴 - Official Video - Eurovision 2021",
      "youtube_video_id": "bp2kfhuv8ZU"
    },
    {
      "rank": 10,
      "video_title": "maNga - We Could Be The Same - Turkey 🇹🇷 - Grand Final - Eurovision 2010",
      "youtube_video_id": "HB_GnnhNz-8"
    },
    {
      "rank": 11,
      "video_title": "",
      "youtube_video_id": ""
    },
    {
      "rank": 12,
      "video_title": "",
      "youtube_video_id": ""
    },
    {
      "rank": 13,
      "video_title": "",
      "youtube_video_id": ""
    },
    {
      "rank": 14,
      "video_title": "",
      "youtube_video_id": ""
    },
    {
      "rank": 15,
      "video_title": "",
      "youtube_video_id": ""
    },
    {
      "rank": 16,
      "video_title": "",
      "youtube_video_id": ""
    },
    {
      "rank": 17,
      "video_title": "",
      "youtube_video_id": ""
    },
    {
      "rank": 18,
      "video_title": "",
      "youtube_video_id": ""
    },
    {
      "rank": 19,
      "video_title": "",
      "youtube_video_id": ""
    },
    {
      "rank": 20,
      "video_title": "",
      "youtube_video_id": ""
    }
  ]
}
