{
  "episode_title": "Eurovision Top 20 Most Watched: March 2022",
  "period": {
    "year": 2022,
    "month": 3
  },
  "youtube_video_id": "NMN-Ik3oFNU",
  "entries": [
    {
      "rank": 1,
      "video_title": "Little Big - Uno - Russia 🇷🇺 - Official Music Video - Eurovision 2020",
      "youtube_video_id": "L_dWvTCdDQ4"
    },
    {
      "rank": 2,
      "video_title": "S10 - De Diepte - Netherlands 🇳🇱 - Official Music Video - Eurovision 2022",
      "youtube_video_id": "v2m-MGSys0k"
    },
    {
      "rank": 3,
      "video_title": "Kalush Orchestra - Stefania - Ukraine 🇺🇦 - Official Music Video - Eurovision 2022",
      "youtube_video_id": "UiEGVYOruLk"
    },
    {
      "rank": 4,
      "video_title": "Konstrakta - In Corpore Sano - Serbia 🇷🇸 - National Final Performance - Eurovision 2022",
      "youtube_video_id": "po7HDHTBBE0"
    },
    {
      "rank": 5,
      "video_title": "Ronela Hajati - Sekret - Albania 🇦🇱 - Official Music Video - Eurovision 2022",
      "youtube_video_id": "iMu47raqbcc"
    },
    {
      "rank": 6,
      "video_title": "LUM!X feat. Pia Maria - Halo - Austria 🇦🇹 - Official Music Video - Eurovision 2022",
      "youtube_video_id": "tF6LY7lnVFU"
    },
    {
      "rank": 7,
      "video_title": "Subwoolfer - Give That Wolf A Banana - Norway 🇳🇴 - National Final Performance - Eurovision 2022",
      "youtube_video_id": "FJjo8s3fKUM"
    },
    {
      "rank": 8,
      "video_title": "Sam Ryder - SPACE MAN - United Kingdom 🇬🇧 - Official Music Video - Eurovision 2022",
      "youtube_video_id": "udsMTb2NIak"
    },
    {
      "rank": 9,
      "video_title": "Måneskin - Zitti E Buoni (LIVE) | Italy 🇮🇹 | Grand Final | Winner of Eurovision 2021",
      "youtube_video_id": "RVH5dn1cxAQ"
    },
    {
      "rank": 10,
      "video_title": "Konstrakta - In Corpore Sano - Serbia 🇷🇸 - Official Music Video - Eurovision 2022",
      "youtube_video_id": "3S1jrYq87Zw"
    },
    {
      "rank": 11,
      "video_title": "Go_A - SHUM - Ukraine 🇺🇦 Official Music Video - Eurovision 2021",
      "youtube_video_id": "U7-dxzp6Jvs"
    },
    {
      "rank": 12,
      "video_title": "Mahmood & BLANCO - Brividi - Italy 🇮🇹 - National Final Performance - Eurovision 2022",
      "youtube_video_id": "4MgMhzfUmiA"
    },
    {
      "rank": 13,
      "video_title": "Cornelia Jakobs - Hold Me Closer - Sweden 🇸🇪 - Official Music Video - Eurovision 2022",
      "youtube_video_id": "wWDThAfryW4"
    },
    {
      "rank": 14,
      "video_title": "Chanel - SloMo - Spain 🇪🇸 - National Final Performance - Eurovision 2022",
      "youtube_video_id": "4mYBiIO0pfY"
    },
    {
      "rank": 15,
      "video_title": "Alexander Rybak - Fairytale (LIVE) | Norway 🇳🇴 | Grand Final | Winner of Eurovision 2009",
      "youtube_video_id": "WXwgZL4zx9o"
    },
    {
      "rank": 16,
      "video_title": "Alvan & Ahez - Fulenn - France 🇫🇷 - Official Music Video - Eurovision 2022",
      "youtube_video_id": "CO07xLUlK2g"
    },
    {
      "rank": 17,
      "video_title": "Rosa Linn - Snap - Armenia 🇦🇲 - Official Music Video - Eurovision 2022",
      "youtube_video_id": "gVqGKkm7xBE"
    },
    {
      "rank": 18,
      "video_title": "Verka Serduchka - Dancing Lasha Tumbai (LIVE) | Ukraine 🇺🇦 | Grand Final | Eurovision 2007",
      "youtube_video_id": "hfjHJneVonE"
    },
    {
      "rank": 19,
      "video_title": "Chanel - SloMo - Spain 🇪🇸 - Official Music Video - Eurovision 2022",
      "youtube_video_id": "N3eiW6E0ldc"
    },
    {
      "rank": 20,
      "video_title": "Go_A - Shum (LIVE) | Ukraine 🇺🇦 | Grand Final | Eurovision 2021",
      "youtube_video_id": "lqvzDkgok_g"
    }
  ]
}
