{
  "episode_title": "Eurovision Top 20 Most Watched: October 2024 | #UnitedByMusic",
  "period": {
    "year": 2024,
    "month": 10
  },
  "youtube_video_id": "pTvDSrMj008",
  "entries": [
    {
      "rank": 1,
      "video_title": "Alexander Rybak - Fairytale (LIVE) | Norway 🇳🇴 | Grand Final | Winner of Eurovision 2009",
      "youtube_video_id": "WXwgZL4zx9o"
    },
    {
      "rank": 2,
      "video_title": "Baby Lasagna - Rim Tim Tagi Dim (LIVE) | Croatia 🇭🇷 | Grand Final | Eurovision 2024",
      "youtube_video_id": "YIBjarAiAVc"
    },
    {
      "rank": 3,
      "video_title": "Joost Klein - Europapa | Netherlands 🇳🇱 | Official Music Video | Eurovision 2024",
      "youtube_video_id": "gT2wY0DjYGo"
    },
    {
      "rank": 4,
      "video_title": "Slimane - Mon Amour (LIVE) | France 🇫🇷 | Grand Final | Eurovision 2024",
      "youtube_video_id": "-XyLecY2JyE"
    },
    {
      "rank": 5,
      "video_title": "Joost Klein - Europapa (LIVE) | Netherlands 🇳🇱 | Second Semi-Final | Eurovision 2024",
      "youtube_video_id": "IiHFnmI8pxg"
    },
    {
      "rank": 6,
      "video_title": "Little Big - Uno - Russia 🇷🇺 - Official Music Video - Eurovision 2020",
      "youtube_video_id": "L_dWvTCdDQ4"
    },
    {
      "rank": 7,
      "video_title": "alyona alyona & Jerry Heil - Teresa & Maria (LIVE) | Ukraine 🇺🇦 | Grand Final | Eurovision 2024",
      "youtube_video_id": "d4N82wPpdg8"
    },
    {
      "rank": 8,
      "video_title": "Nemo - The Code (LIVE) | Switzerland 🇨🇭| Winner of Eurovision 2024",
      "youtube_video_id": "CO_qJf-nW0k"
    },
    {
      "rank": 9,
      "video_title": "Sunstroke Project & Olia Tira - Run Away | Moldova 🇲🇩 (Epic Sax Guy) | Grand Final | Eurovision 2010",
      "youtube_video_id": "pHXDMe6QV-U"
    },
    {
      "rank": 10,
      "video_title": "Hadise - Düm Tek Tek - Türkiye 🇹🇷 - Grand Final - Eurovision 2009",
      "youtube_video_id": "TzKgojZqO5Y"
    },
    {
      "rank": 11,
      "video_title": "Käärijä - Cha Cha Cha (LIVE) | Finland 🇫🇮 | Grand Final | Eurovision 2023",
      "youtube_video_id": "l6rS8Dv5g-8"
    },
    {
      "rank": 12,
      "video_title": "Måneskin - Zitti E Buoni (LIVE) | Italy 🇮🇹 | Grand Final | Winner of Eurovision 2021",
      "youtube_video_id": "RVH5dn1cxAQ"
    },
    {
      "rank": 13,
      "video_title": "Verka Serduchka - Dancing Lasha Tumbai (LIVE) | Ukraine 🇺🇦 | Grand Final | Eurovision 2007",
      "youtube_video_id": "hfjHJneVonE"
    },
    {
      "rank": 14,
      "video_title": "Marina Satti - ZARI (LIVE) | Greece 🇬🇷 | Grand Final | Eurovision 2024",
      "youtube_video_id": "ENb4LCeq9Lc"
    },
    {
      "rank": 15,
      "video_title": "Nemo - The Code | Switzerland 🇨🇭 | Official Music Video | Eurovision 2024",
      "youtube_video_id": "kiGDvM14Kwg"
    },
    {
      "rank": 16,
      "video_title": "Loreen - Euphoria (LIVE) | Sweden 🇸🇪 | Grand Final | Winner of Eurovision 2012",
      "youtube_video_id": "Pfo-8z86x80"
    },
    {
      "rank": 17,
      "video_title": "Bambie Thug - Doomsday Blue (LIVE) | Ireland 🇮🇪 | Grand Final | Eurovision 2024",
      "youtube_video_id": "UMq8ofCstMQ"
    },
    {
      "rank": 18,
      "video_title": "Angelina Mango - La noia (LIVE) | Italy 🇮🇹 | Grand Final | Eurovision 2024",
      "youtube_video_id": "zp1FXHjkjpQ"
    },
    {
      "rank": 19,
      "video_title": "Chanel - SloMo (LIVE) | Spain 🇪🇸 | Grand Final | Eurovision 2022",
      "youtube_video_id": "jSQYTt4xg3I"
    },
    {
      "rank": 20,
      "video_title": "Marcus & Martinus - Unforgettable (LIVE) | Sweden 🇸🇪 | Grand Final | Eurovision 2024",
      "youtube_video_id": "DcZpzObYzxs"
    }
  ]
}
